{
  "task_id": "01-fluid-simulation",
  "model": "Example model (illustration only)",
  "run_id": "run-001",
  "track": "html",
  "rubric": "html-v1",
  "score": {
    "total": 80,
    "launch": 10,
    "completeness": 12,
    "behavior": 16,
    "interaction": 8,
    "technical_depth": 12,
    "visual_quality": 8,
    "robustness": 7,
    "constraint_compliance": 7
  },
  "tags": [
    "agentic"
  ],
  "notes": "Illustrative metadata, not an actual model result. Copy and replace with evaluator observations.",
  "parameters": {},
  "environment": {},
  "metrics": {}
}
