{
  "task_id": "21-import-studio",
  "model": "Example model (illustration only)",
  "run_id": "run-001",
  "track": "real-apps",
  "rubric": "real-apps-v1",
  "score": {
    "total": 82,
    "launch": 10,
    "completeness": 8,
    "behavior": 21,
    "interaction": 8,
    "technical_depth": 12,
    "visual_quality": 4,
    "robustness": 15,
    "constraint_compliance": 4
  },
  "tags": [
    "agentic"
  ],
  "notes": "Illustrative metadata, not an actual model result. Copy and replace with evaluator observations.",
  "parameters": {},
  "environment": {},
  "metrics": {},
  "preview_url": "http://127.0.0.1:8811/"
}
